{
  "schema_version": 1,
  "updated_at": "2026-09-02T18:25:24Z",
  "accepted_architecture": "ADR-001-national-niche-domains",
  "repository_baseline": "3be9046311e785737d4fb23783dc71a8aa83b0f4",
  "repository_capability": "contains_write_paths",
  "deployed_capability": "unverified",
  "automation_phase": "code_only",
  "auto_merge_enabled": false,
  "production_mutations_authorized": false,
  "active_work_packet": "DE-0008",
  "next_step": "Await Codex's exact-head review of the DE-0008 nationwide niche-site registry contract, schema, semantic validator, and fixtures, and complete any remaining remediation cycles.",
  "notes": [
    "The repository README still describes v0.2.0 as read-only while current main contains write-path source code; deployment state must not be inferred from either statement.",
    "No WordPress, Cloudflare, D1, DNS, deployment, secret, redirect, listing, or indexation change is authorized by this state file.",
    "DE-0002's exact-head Project governance run 33555688873 ended without executing a job and did not prove the maker/CI/reviewer/remediation/delta loop end to end. DE-0004 (PR #13) and the App-authenticated exact-head Project governance runs on PR #14 proved the corrected CI path. DE-0006 defined the nationwide URL and listing identity contract and its semantic validator; DE-0007 remediated post-merge audit findings in that same validator and is merged onto main. DE-0008 is the current active, code-only work packet defining the nationwide niche-site registry contract (one canonical site per niche, kept independent of geography and of the DE-0006 in-domain URL/listing identity). None of these authorize any staging, production, or live-system operation."
  ]
}
